Exercise_Name,Description_URL,Exercise_Image,Exercise_Image1,muscle_gp_details,muscle_gp,equipment_details,Equipment,Rating,Description
Standing Hip Circles,"Stand with your feet shoulder-width apart and hands on your hips.
Keeping your upper body still, rotate your hips in a circular motion, first clockwise and then counterclockwise.
Focus on engaging your core and maintaining stability throughout the movement.
Perform the desired number of circles in each direction.",https://www.bodybuilding.com/exercises/exerciseImages/sequences/873/Male/m/873_1.jpg,https://www.bodybuilding.com/exercises/exerciseImages/sequences/873/Male/m/873_2.jpg,https://www.bodybuilding.com/exercises/muscle/abductors,Abductors,https://www.bodybuilding.com/exercises/equipment/body-only,Body Only,8.8,Average
Clam,"Lie on your side with your hips and knees bent, and your feet together.
Keep your hips stacked and your core engaged.
Keeping your feet together, lift your top knee towards the ceiling, opening up your legs like a clamshell.
Pause at the top, then lower your knee back down with control.
Repeat for the desired number of repetitions on each side.",https://www.bodybuilding.com/images/2020/april/2843_1.jpg,https://www.bodybuilding.com/images/2020/april/2843_2.jpg,https://www.bodybuilding.com/exercises/muscle/abductors,Abductors,https://www.bodybuilding.com/exercises/finder,,8.8,Average
Narrow Stance Hack Squats,"Stand with your feet close together and your toes pointed slightly outward.
Position a barbell behind your legs, resting on your lower thighs.
Lower your body by bending your knees while keeping your back straight.
Descend until your thighs are parallel to the ground or slightly below.
Push through your heels to return to the starting position and repeat.",,,https://www.bodybuilding.com/exercises/muscle/quadriceps,Quadriceps,https://www.bodybuilding.com/exercises/equipment/machine,Machine,8.8,Average
Seated Close-Grip Concentration Barbell Curl,"Sit on a bench with your legs spread apart and hold a barbell with a narrow grip in front of you, palms facing up.
Rest your elbows on the insides of your thighs, allowing the barbell to hang down towards the floor.
Keeping your upper arms stationary, curl the barbell towards your chest by flexing your elbows.
Squeeze your biceps at the top of the movement, then lower the barbell back down with control.
Repeat for the desired number of repetitions.",,,https://www.bodybuilding.com/exercises/muscle/biceps,Biceps,https://www.bodybuilding.com/exercises/equipment/barbell,Barbell,8.8,Average
Dumbbell Lying Pronation,"Lie face down on a flat bench with a dumbbell in each hand, palms facing down.
Extend your arms straight down towards the floor.
Keeping your arms straight, raise the dumbbells up towards your sides until your arms are parallel to the floor.
Slowly lower the dumbbells back to the starting position and repeat.",,,https://www.bodybuilding.com/exercises/muscle/forearms,Forearms,https://www.bodybuilding.com/exercises/finder,,8.8,Average
Smith machine box squat,"Position yourself under the Smith machine bar with your feet shoulder-width apart.
Place a box or bench behind you at an appropriate height for sitting.
Lower yourself onto the box, keeping your chest up and back straight.
Pause briefly on the box, then drive through your heels to stand back up.
Repeat for the desired number of repetitions.",,,https://www.bodybuilding.com/exercises/muscle/quadriceps,Quadriceps,https://www.bodybuilding.com/exercises/equipment/barbell,Barbell,8.8,Average
Drop Push,"Start in a plank position with your hands shoulder-width apart.
Lower your chest towards the floor, then explosively push yourself up into the air.
As you reach the peak of your jump, quickly drop back down into the plank position and repeat the movement.",,,https://www.bodybuilding.com/exercises/muscle/chest,Chest,https://www.bodybuilding.com/exercises/equipment/other,Other,8.8,Average
Upside-down pull-up,"Hang from a pull-up bar with your legs extended upwards and your body forming an L-shape.
Engage your back muscles and pull your chest towards the bar, aiming to bring your shoulders towards your hands.
Lower yourself back down with control and repeat for the desired number of repetitions.",,,https://www.bodybuilding.com/exercises/muscle/middle-back,Middle Back,https://www.bodybuilding.com/exercises/equipment/other,Other,8.8,Average
Reverse Barbell Preacher Curls,"Sit on a preacher bench with your chest against the pad and hold a barbell with an overhand grip.
Allow your arms to fully extend downwards.
Curl the barbell upwards towards your shoulders while keeping your upper arms against the pad.
Lower the barbell back down with control and repeat.",,,https://www.bodybuilding.com/exercises/muscle/biceps,Biceps,https://www.bodybuilding.com/exercises/equipment/ez-curl-bar,E-Z Curl Bar,8.8,Average
Close-grip EZ-bar bench press,"Lie on a flat bench with your feet flat on the floor and hold an EZ-bar with a close grip (hands shoulder-width apart).
Lower the barbell towards your chest while keeping your elbows close to your body.
Press the barbell back up to the starting position, fully extending your arms.
Repeat for the desired number of repetitions.",,,https://www.bodybuilding.com/exercises/muscle/chest,Chest,https://www.bodybuilding.com/exercises/equipment/ez-curl-bar,E-Z Curl Bar,8.8,Average
Incline Push-Up,"Position yourself in a push-up position with your hands on elevated surfaces such as a bench or step.
Keep your body straight from head to heels.
Lower your chest towards the elevated surface, then push back up to the starting position.
Repeat for the desired number of repetitions.",,,https://www.bodybuilding.com/exercises/muscle/chest,Chest,https://www.bodybuilding.com/exercises/equipment/body-only,Body Only,8.8,Average
Hyperextensions With No Hyperextension Bench,"Lie face down on the floor with your legs extended and your arms reaching forward.
Lift your chest and upper body off the floor as high as you can while keeping your feet on the ground.
Squeeze your lower back muscles at the top of the movement, then lower back down with control.
Repeat for the desired number of repetitions.",,,https://www.bodybuilding.com/exercises/muscle/lower-back,Lower Back,https://www.bodybuilding.com/exercises/equipment/body-only,Body Only,8.8,Average
Dumbbell front raise,"Stand tall with a dumbbell in each hand, palms facing towards your body.
Keeping your arms straight, lift the dumbbells directly in front of you until they are at shoulder height.
Lower the dumbbells back down with control and repeat.",https://www.bodybuilding.com/images/2020/xdb/cropped/xdb-13d-dumbbell-front-raise-m2-square-600x600.jpg,,https://www.bodybuilding.com/exercises/muscle/shoulders,Shoulders,https://www.bodybuilding.com/exercises/equipment/dumbbell,Dumbbell,8.8,Average
Parallel Bar Dip,"Grab the parallel bars with your palms facing each other and your arms fully extended.
Lower your body by bending your elbows until your upper arms are parallel to the floor.
Press yourself back up to the starting position by straightening your arms.
Repeat for the desired number of repetitions.",https://www.bodybuilding.com/images/2020/xdb/cropped/xdb-1m-triceps-dip-m1-square-600x600.jpg,https://www.bodybuilding.com/images/2020/xdb/cropped/xdb-1m-triceps-dip-m2-square-600x600.jpg,https://www.bodybuilding.com/exercises/muscle/triceps,Triceps,https://www.bodybuilding.com/exercises/equipment/body-only,Body Only,8.8,Average
Stairmaster,"Step onto the Stairmaster machine and adjust the speed and resistance to your preference.
Hold onto the handrails for balance.
Begin stepping up and down, mimicking the motion of climbing stairs.
Maintain a steady pace and engage your leg muscles throughout the exercise.
Continue for your desired duration or until you complete your workout.",https://www.bodybuilding.com/images/2020/xdb/cropped/xdb-51m-stair-climber-m1-square-600x600.jpg,https://www.bodybuilding.com/images/2020/xdb/cropped/xdb-51m-stair-climber-m2-square-600x600.jpg,https://www.bodybuilding.com/exercises/muscle/quadriceps,Quadriceps,https://www.bodybuilding.com/exercises/equipment/machine,Machine,8.8,Average
Double Leg Butt Kick,"Stand tall with your feet hip-width apart.
Bend your knees slightly and engage your core muscles.
Simultaneously kick both heels towards your glutes, aiming to touch them with your hands.
Keep your upper body stable throughout the movement.
Return your heels to the starting position and repeat for the desired number of repetitions.",https://www.bodybuilding.com/exercises/exerciseImages/sequences/778/Male/m/778_1.jpg,https://www.bodybuilding.com/exercises/exerciseImages/sequences/778/Male/m/778_2.jpg,https://www.bodybuilding.com/exercises/muscle/quadriceps,Quadriceps,https://www.bodybuilding.com/exercises/finder,,8.8,Average
Groiners,"Start in a high plank position with your hands directly under your shoulders and your body forming a straight line from head to heels.
Engage your core muscles and jump both feet forward, landing them outside of your hands.
Quickly jump your feet back to the starting plank position.
Repeat the movement, alternating between jumping your feet forward and back in a fluid motion.",,,https://www.bodybuilding.com/exercises/muscle/adductors,Adductors,https://www.bodybuilding.com/exercises/equipment/body-only,Body Only,8.8,Average
Neck Press,"Lie on a flat bench with a barbell racked above your chest.
Grip the barbell with a wider than shoulder-width grip, palms facing away from you.
Lift the barbell off the rack and position it directly above your chest with your arms extended.
Lower the barbell towards your neck while keeping your elbows pointed out to the sides.
Press the barbell back up to the starting position, fully extending your arms.
Repeat for the desired number of repetitions, ensuring controlled movements and proper form.",,,https://www.bodybuilding.com/exercises/muscle/chest,Chest,https://www.bodybuilding.com/exercises/equipment/barbell,Barbell,8.8,Average
Broad jump,"Start by standing with your feet hip-width apart and your knees slightly bent.
Swing your arms back to generate momentum.
Explosively jump forward, extending your hips, knees, and ankles.
Swing your arms forward to help propel your body forward.
Land softly with your knees bent to absorb the impact.
Reset and repeat the jump for the desired number of repetitions.",,,https://www.bodybuilding.com/exercises/muscle/quadriceps,Quadriceps,https://www.bodybuilding.com/exercises/equipment/body-only,Body Only,8.8,Average
Machine Squat,"Adjust the machine to your desired weight and settings.
Position yourself on the machine with your shoulders under the pads and your feet shoulder-width apart.
Grasp the handles for stability.
Lower your body by bending your knees while keeping your back straight.
Descend until your thighs are parallel to the ground or as low as comfortable.
Push through your heels to return to the starting position, fully extending your legs.
Repeat for the desired number of repetitions.",,,https://www.bodybuilding.com/exercises/muscle/quadriceps,Quadriceps,https://www.bodybuilding.com/exercises/equipment/machine,Machine,8.8,Average
V-bar pull-up,"Hang a V-bar attachment from a pull-up bar.
Grip the V-bar with a neutral grip (palms facing each other) and hands shoulder-width apart.
Hang from the bar with your arms fully extended and your body in a straight line.
Engage your back muscles and pull yourself up until your chin is above the bar.
Lower yourself back down to the starting position with control.
Repeat for the desired number of repetitions.",https://www.bodybuilding.com/images/2020/xdb/cropped/2020-xdb-140c-v-bar-pull-up-m1-crop-600x600.jpg,,https://www.bodybuilding.com/exercises/muscle/lats,Lats,https://www.bodybuilding.com/exercises/finder,,8.8,Average
Ring dip,"Hang gymnastic rings from a stable overhead structure.
Grip the rings with a neutral grip (palms facing each other) and extend your arms fully.
Lower your body by bending your elbows until your shoulders are below your elbows.
Keep your torso upright and your elbows close to your body throughout the movement.
Press yourself back up to the starting position, fully extending your arms.
Repeat for the desired number of repetitions.",,,https://www.bodybuilding.com/exercises/muscle/triceps,Triceps,https://www.bodybuilding.com/exercises/equipment/body-only,Body Only,8.8,Average
Standing One-Arm Cable Curl,"Attach a single handle to a low cable pulley.
Stand facing the machine with your feet shoulder-width apart and grasp the handle with one hand.
Keep your elbow close to your body and your upper arm stationary.
Curl the handle towards your shoulder by flexing your elbow.
Squeeze your biceps at the top of the movement.
Slowly lower the handle back to the starting position under control.
Repeat for the desired number of repetitions on each arm.",,,https://www.bodybuilding.com/exercises/muscle/biceps,Biceps,https://www.bodybuilding.com/exercises/equipment/cable,Cable,8.8,Average
Burpee,"Begin in a standing position with your feet shoulder-width apart.
Drop into a squat position and place your hands on the floor in front of you.
Kick your feet back so that you are in a push-up position.
Perform a push-up, if desired.
Quickly bring your feet back to the squat position.
Explosively jump up into the air, reaching your arms overhead.
Land softly and immediately lower back into the squat position to begin the next repetition.
Repeat for the desired number of repetitions.




",https://www.bodybuilding.com/images/2020/xdb/cropped/xdb-38a-burpee-m4-square-600x600.jpg,,https://www.bodybuilding.com/exercises/muscle/quadriceps,Quadriceps,https://www.bodybuilding.com/exercises/equipment/body-only,Body Only,8.8,Average
Double-arm triceps kick-back,"Stand with your feet shoulder-width apart, holding a dumbbell in each hand.
Bend your knees slightly and hinge forward at the hips until your torso is parallel to the ground.
Keep your upper arms close to your sides and extend both forearms behind you until your arms are straight.
Hold for a moment, then slowly lower the weights back to the starting position.",https://www.bodybuilding.com/images/2020/xdb/cropped/xdb-75d-double-arm-triceps-kick-back-m2-square-600x600.jpg,https://www.bodybuilding.com/images/2020/xdb/cropped/xdb-75d-double-arm-triceps-kick-back-m3-square-600x600.jpg,https://www.bodybuilding.com/exercises/muscle/triceps,Triceps,https://www.bodybuilding.com/exercises/equipment/dumbbell,Dumbbell,8.8,Average
Dumbbell reverse lunge,"Stand with your feet hip-width apart, holding a dumbbell in each hand at your sides.
Take a large step backward with your right foot and lower your body until both knees are bent at 90-degree angles.
Keep your chest up and your core engaged to maintain balance.
Push through your left heel to return to the starting position.
Repeat on the other side, alternating legs for each repetition.",https://www.bodybuilding.com/images/2020/xdb/cropped/xdb-83d-dumbbell-reverse-lunge-m1-square-600x600.jpg,,https://www.bodybuilding.com/exercises/muscle/quadriceps,Quadriceps,https://www.bodybuilding.com/exercises/equipment/dumbbell,Dumbbell,8.7,Average
Seated Calf Raise,"Sit on a calf raise machine or bench with your feet flat on the platform and your knees bent at a 90-degree angle.
Place a weight on your thighs or hold a dumbbell in each hand for added resistance.
Press through the balls of your feet to raise your heels as high as possible.
Hold the contraction at the top for a moment, then lower your heels back down below the level of the platform.
Repeat for the desired number of repetitions.",https://www.bodybuilding.com/images/2020/xdb/cropped/xdb-13m-machine-seated-calf-raise-m1-square-600x600.jpg,https://www.bodybuilding.com/images/2020/xdb/cropped/xdb-13m-machine-seated-calf-raise-m2-square-600x600.jpg,https://www.bodybuilding.com/exercises/muscle/calves,Calves,https://www.bodybuilding.com/exercises/equipment/machine,Machine,8.7,Average
Standing dumbbell shrug,"Stand with your feet shoulder-width apart, holding a dumbbell in each hand at your sides with your palms facing inward.
Keeping your arms straight, shrug your shoulders up towards your ears as high as possible.
Hold the contraction at the top for a moment, then lower your shoulders back down to the starting position.
Avoid rolling your shoulders forward or backward during the movement.",https://www.bodybuilding.com/images/2020/xdb/cropped/xdb-115d-standing-dumbbell-shrug-m1-square-600x600.jpg,https://www.bodybuilding.com/images/2020/xdb/cropped/xdb-115d-standing-dumbbell-shrug-m2-square-600x600.jpg,https://www.bodybuilding.com/exercises/muscle/traps,Traps,https://www.bodybuilding.com/exercises/equipment/dumbbell,Dumbbell,8.7,Average
Calf Press On The Leg Press Machine,"Sit on a leg press machine and place your feet shoulder-width apart on the footplate.
Position your toes and the balls of your feet on the footplate with your heels hanging off the edge.
Unlock the safety and push the weight sled upwards by extending your knees and hips until your legs are almost fully extended.
Press through the balls of your feet to raise your heels as high as possible, contracting your calf muscles.
Hold the contraction at the top for a moment, then lower your heels back down to the starting position.",,,https://www.bodybuilding.com/exercises/muscle/calves,Calves,https://www.bodybuilding.com/exercises/equipment/machine,Machine,8.7,Average
Barbell step-up,"Stand facing a bench or platform with a barbell across your upper back and shoulders.
Place one foot onto the bench, ensuring your entire foot is supported.
Push through the heel of your elevated foot to lift your body onto the bench, straightening your leg.
Step down with the opposite foot, returning to the starting position.
Repeat for the desired number of repetitions, then switch legs.",,,https://www.bodybuilding.com/exercises/muscle/quadriceps,Quadriceps,https://www.bodybuilding.com/exercises/equipment/barbell,Barbell,8.7,Average
Feet-elevated bench dip,"Position two benches parallel to each other and place your hands on one bench behind you, fingers facing forward.
Extend your legs and place your heels on the other bench in front of you.
Lower your body by bending your elbows until your upper arms are parallel to the ground.
Press through your palms to straighten your arms and return to the starting position, keeping your elbows close to your body throughout the movement.",,,https://www.bodybuilding.com/exercises/muscle/triceps,Triceps,https://www.bodybuilding.com/exercises/equipment/body-only,Body Only,8.7,Average
Bent Over Barbell Row,"Stand with your feet shoulder-width apart, holding a barbell with an overhand grip, hands slightly wider than shoulder-width.
Hinge forward at the hips while keeping your back straight, allowing the barbell to hang in front of you at arm's length.
Pull the barbell towards your lower chest by retracting your shoulder blades and bending your elbows, keeping them close to your body.
Pause at the top of the movement, then slowly lower the barbell back down to the starting position.",,,https://www.bodybuilding.com/exercises/muscle/middle-back,Middle Back,https://www.bodybuilding.com/exercises/equipment/barbell,Barbell,8.7,Average
Crunches,"Lie on your back with your knees bent and feet flat on the floor, hip-width apart.
Place your hands behind your head or crossed over your chest.
Engage your core muscles and lift your shoulder blades off the floor, curling your upper body towards your knees.
Exhale as you crunch up, then inhale as you lower back down with control.
Avoid pulling on your neck or using momentum to lift your upper body.",,,https://www.bodybuilding.com/exercises/muscle/abdominals,Abdominals,https://www.bodybuilding.com/exercises/equipment/body-only,Body Only,8.7,Average
Dumbbell Alternate Bicep Curl,"Stand with your feet shoulder-width apart, holding a dumbbell in each hand at arm's length by your sides, palms facing forward.
Keep your elbows close to your sides and your upper arms stationary as you curl one dumbbell towards your shoulder, rotating your palm to face your shoulder at the top of the movement.
Lower the dumbbell back down with control, then repeat the movement with the opposite arm.
Continue alternating arms for the desired number of repetitions.",,,https://www.bodybuilding.com/exercises/muscle/biceps,Biceps,https://www.bodybuilding.com/exercises/equipment/dumbbell,Dumbbell,8.7,Average
Bent-over dumbbell rear delt row,"Hold a dumbbell in each hand and bend forward at the hips, keeping your back straight.
Keep your elbows slightly bent and lift the dumbbells out to the sides until they are in line with your shoulders.
Squeeze your shoulder blades together at the top of the movement.
Slowly lower the dumbbells back to the starting position and repeat.",,,https://www.bodybuilding.com/exercises/muscle/shoulders,Shoulders,https://www.bodybuilding.com/exercises/equipment/dumbbell,Dumbbell,8.7,Average
External Rotation with Cable,"Attach a handle to a cable machine at shoulder height.
Stand sideways to the machine and grasp the handle with the hand furthest from the machine.
Keep your elbow bent at a 90-degree angle and your upper arm parallel to the floor.
Rotate your forearm away from your body against the resistance of the cable.
Return to the starting position in a controlled manner and repeat.",,,https://www.bodybuilding.com/exercises/muscle/shoulders,Shoulders,https://www.bodybuilding.com/exercises/finder,Cables,8.7,Average
Handstand push-up,"Start in a handstand position against a wall or using a stable surface for support.
Lower yourself towards the ground by bending your elbows while keeping your body straight.
Press back up to the starting position by straightening your arms.
Repeat for the desired number of repetitions, ensuring control throughout the movement.",,,https://www.bodybuilding.com/exercises/muscle/shoulders,Shoulders,https://www.bodybuilding.com/exercises/equipment/body-only,Body Only,8.7,Average
Single-arm dumbbell preacher curl,"Sit on a preacher bench with one arm resting on the pad and holding a dumbbell.
Keep your upper arm stationary and curl the dumbbell towards your shoulder, contracting your biceps.
Lower the dumbbell back to the starting position in a controlled manner.
Repeat for the desired number of repetitions before switching arms.",https://www.bodybuilding.com/images/2020/xdb/cropped/xdb-53s-single-arm-dumbbell-preacher-curl-m1-square-600x600.jpg,https://www.bodybuilding.com/images/2020/xdb/cropped/xdb-53s-single-arm-dumbbell-preacher-curl-m2-square-600x600.jpg,https://www.bodybuilding.com/exercises/muscle/biceps,Biceps,https://www.bodybuilding.com/exercises/equipment/dumbbell,Dumbbell,8.7,Average
Step-up with knee raise,"Stand facing a sturdy platform or bench.
Step onto the platform with one foot, driving through your heel to lift your body up.
As you step up, bring your opposite knee up towards your chest.
Step back down with control and repeat on the opposite side.
Alternate legs for each repetition.",https://www.bodybuilding.com/images/2020/xdb/cropped/xdb-70e-step-up-with-knee-raise-m1-square-600x600.jpg,https://www.bodybuilding.com/images/2020/xdb/cropped/xdb-70e-step-up-with-knee-raise-m2-square-600x600.jpg,https://www.bodybuilding.com/exercises/muscle/glutes,Glutes,https://www.bodybuilding.com/exercises/equipment/body-only,Body Only,8.7,Average
Smith machine back squat,"Position yourself under the Smith machine barbell, resting it across your upper back and shoulders.
Stand with your feet shoulder-width apart and your toes slightly turned out.
Lower your body by bending at the knees and hips, keeping your back straight and chest up.
Lower until your thighs are parallel to the ground, then press through your heels to return to the starting position.
Repeat for the desired number of repetitions.",https://www.bodybuilding.com/images/2020/xdb/cropped/xdb-18t-smith-machine-back-squat-m1-square-600x600.jpg,https://www.bodybuilding.com/images/2020/xdb/cropped/xdb-18t-smith-machine-back-squat-m2-square-600x600.jpg,https://www.bodybuilding.com/exercises/muscle/quadriceps,Quadriceps,https://www.bodybuilding.com/exercises/equipment/machine,Machine,8.7,Average
Incline dumbbell front raise,"Sit on an incline bench set to a low angle, holding a dumbbell in each hand with your palms facing towards your body.
Allow your arms to hang straight down towards the floor.
Keeping a slight bend in your elbows, lift the dumbbells in front of you until they are at shoulder height.
Slowly lower the dumbbells back to the starting position and repeat.",,,https://www.bodybuilding.com/exercises/muscle/shoulders,Shoulders,https://www.bodybuilding.com/exercises/equipment/dumbbell,Dumbbell,8.7,Average
Alternate Incline Dumbbell Curl,"Sit on an incline bench set to a low angle, holding a dumbbell in each hand with your palms facing towards your body.
Allow your arms to hang straight down towards the floor.
Keeping your elbows close to your sides, curl one dumbbell up towards your shoulder while keeping the other arm stationary.
Lower the dumbbell back to the starting position and repeat with the opposite arm.
Continue alternating arms for the desired number of repetitions.",https://www.bodybuilding.com/images/2020/xdb/cropped/xdb-26n-alternating-incline-dumbbell-biceps-curl-m1-square-600x600.jpg,https://www.bodybuilding.com/images/2020/xdb/cropped/xdb-26n-alternating-incline-dumbbell-biceps-curl-m2-square-600x600.jpg,https://www.bodybuilding.com/exercises/muscle/biceps,Biceps,https://www.bodybuilding.com/exercises/equipment/dumbbell,Dumbbell,8.7,Average
