Exercise_Name,Description_URL,Exercise_Image,Exercise_Image1,muscle_gp_details,muscle_gp,equipment_details,Equipment,Rating,Description
Decline Push-Up,"Get into a push-up position with your feet elevated on a bench or platform and hands shoulder-width apart.
Lower your body towards the ground by bending your elbows, keeping your body in a straight line from head to heels.
Push yourself back up to the starting position by extending your arms fully.
Repeat for the desired number of repetitions.",https://www.bodybuilding.com/images/2020/xdb/cropped/xdb-20e-feet-elevated-push-up-m1-square-600x600.jpg,https://www.bodybuilding.com/images/2020/xdb/cropped/xdb-20e-feet-elevated-push-up-m2-square-600x600.jpg,https://www.bodybuilding.com/exercises/muscle/chest,Chest,https://www.bodybuilding.com/exercises/equipment/body-only,Body Only,8.6,Average
Captain's chair knee raise,"Grip the handles of a captain's chair or dip station and hang with your arms extended.
Lift your knees towards your chest by engaging your core muscles, bringing them as close to your chest as possible.
Lower your knees back down with control to complete one repetition.
Avoid swinging your body or using momentum to lift your legs.",https://www.bodybuilding.com/images/2020/xdb/cropped/xdb-5m-captains-chair-knee-raise-m1-square-600x600.jpg,https://www.bodybuilding.com/images/2020/xdb/cropped/xdb-5m-captains-chair-knee-raise-m2-square-600x600.jpg,https://www.bodybuilding.com/exercises/muscle/abdominals,Abdominals,https://www.bodybuilding.com/exercises/equipment/other,Other,8.6,Average
Triceps Pushdown,"Stand in front of a cable machine with a high pulley attachment, and grasp the bar with an overhand grip.
Keep your elbows close to your sides and your upper arms stationary, press the bar downwards until your arms are fully extended.
Pause briefly at the bottom, then slowly return the bar to the starting position by bending your elbows.
Repeat for the desired number of repetitions.",https://www.bodybuilding.com/images/2020/xdb/cropped/xdb-17c-cable-v-bar-push-down-m1-square-600x600.jpg,https://www.bodybuilding.com/images/2020/xdb/cropped/xdb-17c-cable-v-bar-push-down-m2-square-600x600.jpg,https://www.bodybuilding.com/exercises/muscle/triceps,Triceps,https://www.bodybuilding.com/exercises/equipment/cable,Cable,8.6,Average
Low cable overhead triceps extension,"Attach a rope or bar to a low pulley cable machine.
Stand facing away from the machine and grab the handle with both hands overhead, palms facing each other.
Keep your elbows close to your head and extend your arms fully, then return to the starting position.
Ensure to keep your core engaged and avoid arching your back excessively.",,,https://www.bodybuilding.com/exercises/muscle/triceps,Triceps,https://www.bodybuilding.com/exercises/equipment/cable,Cable,8.6,Average
Single-arm cable cross-over,"Attach a single handle to a cable machine set to shoulder height.
Stand with your side to the machine and grasp the handle with one hand, palm facing down.
Pull the handle across your body and down towards your opposite hip in a sweeping motion.
Return to the starting position with control, then repeat for the desired number of repetitions.
Switch sides and repeat the exercise with the opposite arm.",,,https://www.bodybuilding.com/exercises/muscle/chest,Chest,https://www.bodybuilding.com/exercises/equipment/cable,Cable,8.6,Average
Seated dumbbell biceps curl,"Sit on a bench with back support and hold a dumbbell in each hand, palms facing up.
Keep your elbows close to your sides and curl the dumbbells upwards towards your shoulders.
Squeeze your biceps at the top of the movement, then lower the dumbbells back down with control.
Repeat for the desired number of repetitions.",,,https://www.bodybuilding.com/exercises/muscle/biceps,Biceps,https://www.bodybuilding.com/exercises/equipment/dumbbell,Dumbbell,8.6,Average
Battle ropes,"Stand with your feet shoulder-width apart, knees slightly bent, and hold one end of each battle rope in each hand.
Begin making alternating waves with the ropes by lifting and lowering each arm rapidly.
Maintain a strong core and rhythmically move the ropes for the desired duration or reps.",,,https://www.bodybuilding.com/exercises/muscle/shoulders,Shoulders,https://www.bodybuilding.com/exercises/equipment/other,Other,8.6,Average
Dead bug reach,"Lie on your back with your arms extended towards the ceiling and your legs bent at a 90-degree angle.
Lower your right arm and left leg towards the floor simultaneously, keeping them close to the ground but not touching it.
Return to the starting position and repeat on the opposite side.
Continue alternating sides for the desired number of reps.",,,https://www.bodybuilding.com/exercises/muscle/abdominals,Abdominals,https://www.bodybuilding.com/exercises/equipment/body-only,Body Only,8.6,Average
Deadlift with Chains,"Load a barbell with chains on each end.
Stand with your feet hip-width apart, toes under the barbell, and grip the barbell with hands shoulder-width apart.
Engage your core, keep your back straight, and lift the barbell by extending your hips and knees until you're standing upright.
Lower the barbell back down in a controlled manner, maintaining proper form throughout.",,,https://www.bodybuilding.com/exercises/muscle/lower-back,Lower Back,https://www.bodybuilding.com/exercises/equipment/barbell,Barbell,8.6,Average
Rope Crunch,"Attach a rope to a high pulley cable machine and kneel facing away from the machine.
Grab the rope with both hands and bring it down towards your knees, bending at the waist and contracting your abs.
Slowly return to the starting position, keeping tension on your abs throughout the movement.
Repeat for the desired number of reps.",https://www.bodybuilding.com/images/2020/xdb/cropped/xdb-35c-kneeling-cable-crunch-m1-square-600x600.jpg,https://www.bodybuilding.com/images/2020/xdb/cropped/xdb-35c-kneeling-cable-crunch-m2-square-600x600.jpg,https://www.bodybuilding.com/exercises/muscle/abdominals,Abdominals,https://www.bodybuilding.com/exercises/equipment/cable,Cable,8.6,Average
Palms-Up Dumbbell Wrist Curl Over A Bench,"Sit on a bench with your forearms resting on your thighs and palms facing up, holding a dumbbell in each hand.
Allow the wrists to extend fully, then curl the dumbbells upwards by flexing your wrists.
Lower the dumbbells back down with control, feeling the stretch in your forearms.
Repeat for the desired number of reps.",,,https://www.bodybuilding.com/exercises/muscle/forearms,Forearms,https://www.bodybuilding.com/exercises/equipment/dumbbell,Dumbbell,8.6,Average
Kettlebell thruster,"Hold a kettlebell in front of your chest with both hands, palms facing inwards, and feet shoulder-width apart.
Squat down, keeping your chest up and weight in your heels.
Explosively drive through your heels to stand up while pressing the kettlebell overhead.
Lower the kettlebell back to the starting position and repeat for the desired number of reps.",,,https://www.bodybuilding.com/exercises/muscle/glutes,Glutes,https://www.bodybuilding.com/exercises/equipment/kettlebells,Kettlebells,8.6,Average
Single-Arm Push-Up,"Get into a push-up position with your hands shoulder-width apart and one hand slightly elevated on a stable surface.
Lower your chest towards the ground while keeping your body in a straight line.
Push back up to the starting position using only one arm.
Repeat on the opposite side or continue alternating arms for the desired number of reps.",,,https://www.bodybuilding.com/exercises/muscle/chest,Chest,https://www.bodybuilding.com/exercises/equipment/body-only,Body Only,8.6,Average
Band Hip Adductions,"Attach a resistance band to a stable anchor point and loop it around one ankle.
Stand sideways to the anchor point with the banded leg closest to it.
Keeping your upper body stable, bring the banded leg across your body towards the midline, then return to the starting position.
Repeat for the desired number of reps before switching sides.",https://www.bodybuilding.com/exercises/exerciseImages/sequences/850/Male/m/850_2.jpg,,https://www.bodybuilding.com/exercises/muscle/adductors,Adductors,https://www.bodybuilding.com/exercises/equipment/bands,Bands,8.6,Average
Single-arm kettlebell clean,"Stand with your feet shoulder-width apart and a kettlebell on the ground between your feet.
Squat down and grab the kettlebell with one hand, keeping your back flat and chest up.
Explosively extend your hips, pull the kettlebell upwards, and catch it in the racked position at shoulder height.
Lower the kettlebell back down and repeat for the desired number of reps on each arm.",https://www.bodybuilding.com/images/2020/xdb/cropped/xdb-80k-single-arm-kettlebell-clean-m1-square-600x600.jpg,https://www.bodybuilding.com/images/2020/xdb/cropped/xdb-80k-single-arm-kettlebell-clean-m2-square-600x600.jpg,https://www.bodybuilding.com/exercises/muscle/hamstrings,Hamstrings,https://www.bodybuilding.com/exercises/equipment/kettlebells,Kettlebells,8.6,Average
Preacher Hammer Dumbbell Curl,"Sit on a preacher bench with your arms extended over the pad and palms facing inwards.
Hold a dumbbell in each hand with your palms facing each other.
Curl the dumbbells towards your shoulders, keeping your upper arms stationary and elbows close to your body.
Lower the dumbbells back down in a controlled manner and repeat for the desired number of reps.",https://www.bodybuilding.com/exercises/exerciseImages/sequences/155/Male/m/155_1.jpg,https://www.bodybuilding.com/exercises/exerciseImages/sequences/155/Male/m/155_2.jpg,https://www.bodybuilding.com/exercises/muscle/biceps,Biceps,https://www.bodybuilding.com/exercises/equipment/dumbbell,Dumbbell,8.6,Average
Alternating Kettlebell Press,"a. Stand with your feet shoulder-width apart, holding a kettlebell in each hand at shoulder height.
b. Press one kettlebell overhead while keeping the other at shoulder height.
c. Lower the pressed kettlebell back to shoulder height while pressing the other kettlebell overhead.
d. Continue alternating presses between each arm.",https://www.bodybuilding.com/exercises/exerciseImages/sequences/504/Male/m/504_1.jpg,https://www.bodybuilding.com/exercises/exerciseImages/sequences/504/Male/m/504_2.jpg,https://www.bodybuilding.com/exercises/muscle/shoulders,Shoulders,https://www.bodybuilding.com/exercises/equipment/kettlebells,Kettlebells,8.6,Average
Split Squat with Dumbbells,"a. Stand with one foot forward and the other foot back, holding a dumbbell in each hand by your sides.
b. Lower your body by bending both knees until your back knee almost touches the ground.
c. Keep your torso upright and your front knee aligned with your ankle.
d. Push through your front heel to return to the starting position.
e. Repeat the movement for the desired number of repetitions, then switch legs.",https://www.bodybuilding.com/images/2020/xdb/cropped/xdb-61e-dumbbell-bulgarian-split-squat-m1-square-600x600.jpg,https://www.bodybuilding.com/images/2020/xdb/cropped/xdb-61e-dumbbell-bulgarian-split-squat-m2-square-600x600.jpg,https://www.bodybuilding.com/exercises/muscle/quadriceps,Quadriceps,https://www.bodybuilding.com/exercises/equipment/dumbbell,Dumbbell,8.6,Average
Standing One-Arm Dumbbell Curl Over Incline Bench,"a. Set an incline bench to a comfortable angle and sit on it with a dumbbell in one hand, palm facing up.
b. Rest the back of your arm against the incline bench and allow your arm to fully extend downwards.
c. Curl the dumbbell upwards towards your shoulder while keeping your upper arm stationary.
d. Slowly lower the dumbbell back to the starting position.
e. Complete the desired number of repetitions on one arm before switching to the other arm.",,,https://www.bodybuilding.com/exercises/muscle/biceps,Biceps,https://www.bodybuilding.com/exercises/finder,,8.6,Average
Standing Olympic Plate Hand Squeeze,"a. Stand with your feet shoulder-width apart, holding an Olympic plate with both hands in front of you.
b. Squeeze the plate between your hands with maximum force, engaging your forearm and hand muscles.
c. Hold the squeeze for a few seconds, then release.
d. Repeat for the desired number of repetitions, focusing on maintaining a strong grip throughout.",,,https://www.bodybuilding.com/exercises/muscle/forearms,Forearms,https://www.bodybuilding.com/exercises/equipment/other,Other,8.6,Average
Sledgehammer swing,"a. Stand with your feet shoulder-width apart, holding a sledgehammer with both hands towards the end of the handle.
b. Swing the sledgehammer over one shoulder and down towards the opposite side of your body, rotating your torso.
c. Reverse the movement and swing the sledgehammer back to the starting position.
d. Repeat the movement, alternating sides with each swing.",,,https://www.bodybuilding.com/exercises/muscle/abdominals,Abdominals,https://www.bodybuilding.com/exercises/equipment/other,Other,8.6,Average
Kneeling Squat,"a. Kneel on a mat with your knees hip-width apart and your toes pointing behind you.
b. Sit back on your heels and lower your buttocks towards your heels while keeping your torso upright.
c. Engage your core and push through your heels to return to the starting position.
d. Repeat the movement for the desired number of repetitions, focusing on maintaining proper form.",https://www.bodybuilding.com/exercises/exerciseImages/sequences/697/Male/m/697_1.jpg,https://www.bodybuilding.com/exercises/exerciseImages/sequences/697/Male/m/697_2.jpg,https://www.bodybuilding.com/exercises/muscle/glutes,Glutes,https://www.bodybuilding.com/exercises/equipment/barbell,Barbell,8.6,Average
Single-arm kettlebell snatch,"a. Start with a kettlebell between your feet and hinge at your hips to grip it with one hand.
b. Swing the kettlebell back between your legs and then explosively drive your hips forward to propel the kettlebell upwards.
c. As the kettlebell reaches shoulder height, pull it overhead by bending your elbow and rotating your wrist.
d. Lock your arm out overhead and stand up straight, then lower the kettlebell back down with control.
e. Repeat for the desired number of repetitions on one arm before switching to the other arm.",,,https://www.bodybuilding.com/exercises/muscle/shoulders,Shoulders,https://www.bodybuilding.com/exercises/equipment/kettlebells,Kettlebells,8.6,Average
Close-grip barbell curl,"a. Stand with your feet shoulder-width apart, holding a barbell with a narrow grip (hands closer than shoulder-width apart).
b. Keep your elbows close to your sides and curl the barbell upwards towards your shoulders.
c. Squeeze your biceps at the top of the movement, then slowly lower the barbell back to the starting position.
d. Repeat for the desired number of repetitions, focusing on maintaining control throughout the movement.",https://www.bodybuilding.com/images/2020/xdb/cropped/xdb-20b-close-grip-barbell-curl-m1-square-600x600.jpg,https://www.bodybuilding.com/images/2020/xdb/cropped/xdb-20b-close-grip-barbell-curl-m2-square-600x600.jpg,https://www.bodybuilding.com/exercises/muscle/biceps,Biceps,https://www.bodybuilding.com/exercises/equipment/barbell,Barbell,8.6,Average
Box jump,"a. Stand facing a sturdy box or platform with your feet shoulder-width apart.
b. Bend your knees and swing your arms back, then explosively jump onto the box, landing softly with both feet.
c. Stand up tall on top of the box, then step or jump back down to the starting position.
d. Repeat for the desired number of repetitions, focusing on landing softly and using your leg muscles to propel yourself upward.",,,https://www.bodybuilding.com/exercises/muscle/hamstrings,Hamstrings,https://www.bodybuilding.com/exercises/equipment/other,Other,8.6,Average
Standing cable crunch,"a. Attach a rope handle to a high cable pulley and adjust the weight.
b. Stand facing away from the cable machine, holding the rope handle above your head with your arms extended.
c. Bend at the waist while keeping your back straight, bringing your elbows towards your knees.
d. Contract your abdominal muscles at the bottom of the movement, then slowly return to the starting position.
e. Repeat for the desired number of repetitions, focusing on engaging your core throughout the movement.",,,https://www.bodybuilding.com/exercises/muscle/abdominals,Abdominals,https://www.bodybuilding.com/exercises/equipment/cable,Cable,8.6,Average
Leverage Incline Chest Press,"Adjust the bench to a 30-45 degree incline.
Sit on the bench and grip the handles of the chest press machine.
Press the handles forward until your arms are fully extended, then slowly lower them back down.",https://www.bodybuilding.com/exercises/exerciseImages/sequences/893/Male/m/893_1.jpg,https://www.bodybuilding.com/exercises/exerciseImages/sequences/893/Male/m/893_2.jpg,https://www.bodybuilding.com/exercises/muscle/chest,Chest,https://www.bodybuilding.com/exercises/equipment/machine,Machine,8.6,Average
Standing barbell overhead triceps extension,"Stand with your feet shoulder-width apart and hold a barbell with an overhand grip.
Lift the barbell overhead with your arms fully extended.
Lower the barbell behind your head by bending your elbows, keeping your upper arms stationary.
Extend your elbows to raise the barbell back to the starting position.",,,https://www.bodybuilding.com/exercises/muscle/triceps,Triceps,https://www.bodybuilding.com/exercises/equipment/barbell,Barbell,8.6,Average
Lying cable triceps extension,"Lie on a flat bench with your head at the end where the cable machine is.
Hold the handle of a cable attachment with both hands above your chest.
Extend your arms straight up, then lower the handle towards your forehead by bending your elbows.
Extend your arms again to return to the starting position.",,,https://www.bodybuilding.com/exercises/muscle/triceps,Triceps,https://www.bodybuilding.com/exercises/equipment/cable,Cable,8.6,Average
Kettlebell Turkish Get-Up (Squat style),"Lie on your back with a kettlebell in one hand, arm extended towards the ceiling.
Bend your knee on the same side as the kettlebell and place your foot flat on the ground.
Push through your heel to lift your torso off the ground, keeping your arm extended.
Stand up while keeping the kettlebell overhead, then reverse the motion to return to the starting position.",https://www.bodybuilding.com/exercises/exerciseImages/sequences/527/Male/m/527_1.jpg,https://www.bodybuilding.com/exercises/exerciseImages/sequences/527/Male/m/527_2.jpg,https://www.bodybuilding.com/exercises/muscle/shoulders,Shoulders,https://www.bodybuilding.com/exercises/finder,,8.6,Average
Crunch - Hands Overhead,"Lie on your back with your knees bent and feet flat on the ground.
Extend your arms overhead, either crossed or parallel.
Contract your abdominal muscles to lift your shoulders off the ground, aiming to bring your ribcage towards your pelvis.
Lower your shoulders back down to complete one repetition.",https://www.bodybuilding.com/exercises/exerciseImages/sequences/113/Male/m/113_1.jpg,https://www.bodybuilding.com/exercises/exerciseImages/sequences/113/Male/m/113_2.jpg,https://www.bodybuilding.com/exercises/muscle/abdominals,Abdominals,https://www.bodybuilding.com/exercises/equipment/body-only,Body Only,8.6,Average
Cable Internal Rotation,"Attach a handle to the low pulley of a cable machine.
Stand sideways to the machine with the arm closest to the machine holding the handle.
Keep your elbow at a 90-degree angle and your forearm parallel to the ground.
Rotate your arm towards your body's midline against the resistance of the cable, then return to the starting position.",https://www.bodybuilding.com/exercises/exerciseImages/sequences/315/Male/m/315_1.jpg,https://www.bodybuilding.com/exercises/exerciseImages/sequences/315/Male/m/315_2.jpg,https://www.bodybuilding.com/exercises/muscle/shoulders,Shoulders,https://www.bodybuilding.com/exercises/equipment/cable,Cable,8.6,Average
Leg Extensions,"Sit on a leg extension machine with your knees bent at 90 degrees.
Place your ankles under the padded bar.
Extend your legs to straighten them against the resistance, then slowly lower them back to the starting position.",https://www.bodybuilding.com/images/2020/xdb/cropped/xdb-18m-leg-extension-m1-square-600x600.jpg,https://www.bodybuilding.com/images/2020/xdb/cropped/xdb-18m-leg-extension-m2-square-600x600.jpg,https://www.bodybuilding.com/exercises/muscle/quadriceps,Quadriceps,https://www.bodybuilding.com/exercises/equipment/machine,Machine,8.5,Average
Standing One-Arm Dumbbell Curl Over Incline Bench,"Set an incline bench to a 45-degree angle.
Stand next to the bench holding a dumbbell in one hand, palm facing up.
Place the back of your upper arm against the top of the incline bench for support.
Curl the dumbbell towards your shoulder, keeping your elbow stationary, then lower it back down.",https://www.bodybuilding.com/exercises/exerciseImages/sequences/339/Male/m/339_1.jpg,https://www.bodybuilding.com/exercises/exerciseImages/sequences/339/Male/m/339_2.jpg,https://www.bodybuilding.com/exercises/muscle/biceps,Biceps,https://www.bodybuilding.com/exercises/finder,,8.6,Average
Standing Olympic Plate Hand Squeeze,"Stand with your feet shoulder-width apart, holding an Olympic plate with both hands in front of you.
Squeeze the plate between your palms with as much force as possible.
Hold the squeeze for a few seconds, then release and repeat.",https://www.bodybuilding.com/exercises/exerciseImages/sequences/6/Male/m/6_1.jpg,https://www.bodybuilding.com/exercises/exerciseImages/sequences/6/Male/m/6_2.jpg,https://www.bodybuilding.com/exercises/muscle/forearms,Forearms,https://www.bodybuilding.com/exercises/equipment/other,Other,8.6,Average
Sledgehammer swing,"Stand with your feet shoulder-width apart, holding a sledgehammer with both hands near the end of the handle.
Swing the sledgehammer overhead and down towards the ground, keeping your arms straight and using your core and hip rotation to generate power.
Alternate sides with each swing, maintaining control and balance throughout the movement.",https://www.bodybuilding.com/images/2020/xdb/cropped/2019-xdb-186s-sledghehammer-swing-m1-600x600.jpg,https://www.bodybuilding.com/images/2020/xdb/cropped/2019-xdb-186s-sledghehammer-swing-m3-600x600.jpg,https://www.bodybuilding.com/exercises/muscle/abdominals,Abdominals,https://www.bodybuilding.com/exercises/equipment/other,Other,8.6,Average
Single-arm kettlebell snatch,"a. Start with a kettlebell on the ground between your legs.
b. Squat down and grab the kettlebell with one hand, keeping your back straight.
c. Explosively extend your hips and knees while simultaneously pulling the kettlebell up.
d. As the kettlebell reaches shoulder height, rotate your hand and punch it overhead.
e. Lock out your arm at the top, then lower the kettlebell back down under control.",https://www.bodybuilding.com/images/2020/xdb/cropped/xdb-79k-single-arm-kettlebell-snatch-m1-square-600x600.jpg,https://www.bodybuilding.com/images/2020/xdb/cropped/xdb-79k-single-arm-kettlebell-snatch-m2-square-600x600.jpg,https://www.bodybuilding.com/exercises/muscle/shoulders,Shoulders,https://www.bodybuilding.com/exercises/equipment/kettlebells,Kettlebells,8.6,Average
Box jump,"a. Stand in front of a sturdy box or platform with your feet shoulder-width apart.
b. Bend your knees and swing your arms back.
c. Explosively jump onto the box, swinging your arms forward for momentum.
d. Land softly on the box with both feet, absorbing the impact with your legs.
e. Step back down or jump down carefully and repeat.",https://www.bodybuilding.com/images/2020/xdb/cropped/xdb-75e-box-jump-m1-square-600x600.jpg,https://www.bodybuilding.com/images/2020/xdb/cropped/xdb-75e-box-jump-m3-square-600x600.jpg,https://www.bodybuilding.com/exercises/muscle/hamstrings,Hamstrings,https://www.bodybuilding.com/exercises/equipment/other,Other,8.6,Average
Standing cable crunch,"a. Attach a rope handle to a high pulley on a cable machine.
b. Stand facing away from the machine, holding the rope over your shoulders.
c. Keep your feet shoulder-width apart and your knees slightly bent.
d. Crunch your torso downwards by contracting your abs while keeping your hips stationary.
e. Slowly return to the starting position and repeat.",https://www.bodybuilding.com/images/2020/xdb/cropped/xdb-34c-standing-cable-crunch-m1-square-600x600.jpg,https://www.bodybuilding.com/images/2020/xdb/cropped/xdb-34c-standing-cable-crunch-m2-square-600x600.jpg,https://www.bodybuilding.com/exercises/muscle/abdominals,Abdominals,https://www.bodybuilding.com/exercises/equipment/cable,Cable,8.6,Average
Standing barbell overhead triceps extension,"a. Stand with your feet shoulder-width apart, holding a barbell with an overhand grip.
b. Lift the barbell overhead with your arms fully extended.
c. Lower the barbell behind your head by bending your elbows.
d. Keep your upper arms stationary as you lower the barbell until your elbows are at about 90 degrees.
e. Extend your elbows to raise the barbell back to the starting position and repeat.",https://www.bodybuilding.com/images/2020/xdb/cropped/xdb-60b-standing-barbell-overhead-triceps-extension-m1-square-600x600.jpg,https://www.bodybuilding.com/images/2020/xdb/cropped/xdb-60b-standing-barbell-overhead-triceps-extension-m2-square-600x600.jpg,https://www.bodybuilding.com/exercises/muscle/triceps,Triceps,https://www.bodybuilding.com/exercises/equipment/barbell,Barbell,8.6,Average
