Exercise_Name,Description_URL,Exercise_Image,Exercise_Image1,muscle_gp_details,muscle_gp,equipment_details,Equipment,Rating,Description
Hanging toes-to-bar,"a. Hang from a pull-up bar with an overhand grip, hands slightly wider than shoulder-width apart.
b. Engage your core and lift your toes towards the bar by flexing your hips and bending your knees.
c. Aim to touch your toes to the bar or get as close as possible.
d. Slowly lower your legs back down to the starting position.
e. Repeat for the desired number of repetitions.",,,https://www.bodybuilding.com/exercises/muscle/abdominals,Abdominals,https://www.bodybuilding.com/exercises/equipment/body-only,Body Only,9,Average
Narrow-stance squat,"a. Stand with your feet hip-width apart, toes pointing forward or slightly turned out.
b. Bring your feet closer together so they're about shoulder-width apart or narrower.
c. Keeping your chest up and core engaged, lower your body down by bending your knees.
d. Descend until your thighs are parallel to the ground or as low as you can comfortably go.
e. Push through your heels to return to the starting position.
f. Repeat for the desired number of repetitions.",,,https://www.bodybuilding.com/exercises/muscle/quadriceps,Quadriceps,https://www.bodybuilding.com/exercises/equipment/barbell,Barbell,9,Average
Kneeling cable oblique crunch,"a. Attach a rope handle to a high cable pulley and kneel down facing away from the machine.
b. Hold the handle with both hands and position it next to your head, elbows bent.
c. Keeping your hips stationary, contract your obliques to bring your elbows down towards your hips.
d. Pause briefly at the bottom of the movement, then slowly return to the starting position.
e. Repeat for the desired number of repetitions, then switch sides.",,,https://www.bodybuilding.com/exercises/muscle/abdominals,Abdominals,https://www.bodybuilding.com/exercises/equipment/cable,Cable,9,Average
Reverse Grip Triceps Pushdown,"a. Attach a straight or angled bar to a high cable pulley.
b. Stand facing the cable machine with your feet shoulder-width apart and grab the bar with an underhand grip, hands close together.
c. Keep your elbows close to your sides and extend your arms downwards, pushing the bar towards the ground.
d. Pause briefly when your arms are fully extended, then slowly return to the starting position.
e. Repeat for the desired number of repetitions.",https://www.bodybuilding.com/images/2020/xdb/cropped/xdb-19c-reverse-grip-cable-straight-bar-push-down-m2-square-600x600.jpg,,https://www.bodybuilding.com/exercises/muscle/triceps,Triceps,https://www.bodybuilding.com/exercises/equipment/cable,Cable,9,Average
Bear crawl sled drag,"a. Attach a harness to a sled loaded with weight plates.
b. Get into a bear crawl position with your hands on the ground directly underneath your shoulders and your knees bent at 90 degrees.
c. Engage your core and start walking forward, pulling the sled behind you with your arms.
d. Keep your back flat and your hips low as you move.
e. Continue crawling forward for the desired distance or time.",,,https://www.bodybuilding.com/exercises/muscle/quadriceps,Quadriceps,https://www.bodybuilding.com/exercises/equipment/other,Other,9,Average
Rocky Pull-Ups/Pulldowns,"a. Sit at a lat pulldown machine with a wide grip on the bar.
b. Pull the bar down towards your chest, retracting your shoulder blades.
c. As you pull down, lean your torso back slightly and arch your back.
d. Return the bar to the starting position under control.
e. Repeat for the desired number of repetitions.",,,https://www.bodybuilding.com/exercises/muscle/lats,Lats,https://www.bodybuilding.com/exercises/equipment/other,Other,9,Average
Snatch-Grip Behind-The-Neck Overhead Press,"a. Stand with your feet shoulder-width apart and grip a barbell with a wide snatch grip, palms facing away from you.
b. Lift the barbell overhead, bringing it behind your neck.
c. Press the barbell upwards until your arms are fully extended.
d. Lower the barbell back down to the starting position behind your neck.
e. Repeat for the desired number of repetitions.",https://www.bodybuilding.com/exercises/exerciseImages/sequences/4571/Male/m/4571_1.jpg,https://www.bodybuilding.com/exercises/exerciseImages/sequences/4571/Male/m/4571_2.jpg,https://www.bodybuilding.com/exercises/muscle/shoulders,Shoulders,https://www.bodybuilding.com/exercises/equipment/barbell,Barbell,9,Average
Box Squat with Bands,"a. Set up a box or bench behind you in the squat rack and attach resistance bands to the barbell.
b. Sit back onto the box with the bands stretched, keeping your feet shoulder-width apart.
c. Maintain tension in the bands as you explosively stand up, driving through your heels.
d. Lock out your hips at the top of the movement, then sit back down onto the box.
e. Repeat for the desired number of repetitions.",https://www.bodybuilding.com/exercises/exerciseImages/sequences/666/Male/m/666_1.jpg,https://www.bodybuilding.com/exercises/exerciseImages/sequences/666/Male/m/666_2.jpg,https://www.bodybuilding.com/exercises/muscle/quadriceps,Quadriceps,https://www.bodybuilding.com/exercises/equipment/barbell,Barbell,9,Average
Flexor Incline Dumbbell Curls,"a. Set an incline bench to a low angle.
b. Sit on the bench with a dumbbell in each hand, palms facing up.
c. Let your arms hang straight down towards the floor.
d. Curl the dumbbells towards your shoulders, keeping your elbows stationary.
e. Squeeze your biceps at the top of the movement, then slowly lower the dumbbells back down.
f. Repeat for the desired number of repetitions.",https://www.bodybuilding.com/exercises/exerciseImages/sequences/285/Male/m/285_1.jpg,,https://www.bodybuilding.com/exercises/muscle/biceps,Biceps,https://www.bodybuilding.com/exercises/equipment/dumbbell,Dumbbell,9,Average
Seated One-Arm Dumbbell Palms-Up Wrist Curl,"Sit on a bench with a dumbbell in one hand, palm facing up, and your forearm resting on your thigh.
Lower the dumbbell towards the floor by curling your wrist downwards.
Slowly curl the weight back up towards your body by flexing your wrist, feeling the contraction in your forearm.
Repeat for the desired number of repetitions, then switch sides.",https://www.bodybuilding.com/exercises/exerciseImages/sequences/386/Male/m/386_1.jpg,,https://www.bodybuilding.com/exercises/muscle/forearms,Forearms,https://www.bodybuilding.com/exercises/equipment/dumbbell,Dumbbell,9,Average
Thigh adductor,"Sit on the thigh adductor machine with your back against the support pad and your legs straddling the padded arms.
Adjust the weight and select the appropriate resistance.
Squeeze your thighs together to bring the padded arms towards each other.
Slowly return to the starting position, allowing the machine to open your legs back to the starting position.
Repeat for the desired number of repetitions.",,,https://www.bodybuilding.com/exercises/muscle/adductors,Adductors,https://www.bodybuilding.com/exercises/equipment/machine,Machine,9,Average
Machine Bicep Curl,"Sit on the machine bench with your back against the pad and grab the handles with an underhand grip.
Keep your upper arms stationary and curl the handles towards your shoulders, squeezing your biceps at the top of the movement.
Slowly lower the handles back to the starting position under control.
Repeat for the desired number of repetitions.",https://www.bodybuilding.com/exercises/exerciseImages/sequences/899/Male/m/899_2.jpg,,https://www.bodybuilding.com/exercises/muscle/biceps,Biceps,https://www.bodybuilding.com/exercises/equipment/machine,Machine,9,Average
Seated Palms-Down Barbell Wrist Curl,"Sit on a bench with a barbell in your hands, palms facing down, and your forearms resting on your thighs.
Lower the barbell towards the floor by curling your wrists downwards.
Slowly curl the weight back up towards your body by flexing your wrists, feeling the contraction in your forearms.
Repeat for the desired number of repetitions.",https://www.bodybuilding.com/exercises/exerciseImages/sequences/389/Male/m/389_1.jpg,https://www.bodybuilding.com/exercises/exerciseImages/sequences/389/Male/m/389_2.jpg,https://www.bodybuilding.com/exercises/muscle/forearms,Forearms,https://www.bodybuilding.com/exercises/finder,,9,Average
Single-arm incline rear delt raise,"Sit on an incline bench set to a low angle, holding a dumbbell in one hand.
Lean forward slightly with your chest against the bench and your arm hanging down towards the floor.
Raise the dumbbell out to the side, keeping your arm straight, until it reaches shoulder height.
Lower the dumbbell back down under control.
Repeat for the desired number of repetitions, then switch sides.",https://www.bodybuilding.com/images/2020/xdb/cropped/xdb-14n-single-arm-incline-rear-delt-raise-m1-square-600x600.jpg,https://www.bodybuilding.com/images/2020/xdb/cropped/xdb-14n-single-arm-incline-rear-delt-raise-m2-square-600x600.jpg,https://www.bodybuilding.com/exercises/muscle/shoulders,Shoulders,https://www.bodybuilding.com/exercises/equipment/dumbbell,Dumbbell,9,Average
Alternating dumbbell front raise,"Stand with a dumbbell in each hand, palms facing your thighs.
Keeping your arms straight, raise one dumbbell directly in front of you until it reaches shoulder height.
Lower the dumbbell back down slowly while simultaneously raising the other dumbbell.
Continue alternating between arms for the desired number of repetitions.",https://www.bodybuilding.com/images/2020/xdb/cropped/xdb-14d-alternating-dumbbell-front-raise-m1-square-600x600.jpg,https://www.bodybuilding.com/images/2020/xdb/cropped/xdb-14d-alternating-dumbbell-front-raise-m2-square-600x600.jpg,https://www.bodybuilding.com/exercises/muscle/shoulders,Shoulders,https://www.bodybuilding.com/exercises/equipment/dumbbell,Dumbbell,9,Average
Hanging toes-to-bar,"Hang from a pull-up bar with an overhand grip, hands shoulder-width apart.
Engage your core and lift your legs, bending at the waist, until your toes touch the bar.
Slowly lower your legs back down to the starting position under control.
Repeat for the desired number of repetitions.",https://www.bodybuilding.com/images/2020/xdb/cropped/2019-xdb-128c-hanging-toes-to-bar-m1-600x600.jpg,https://www.bodybuilding.com/images/2020/xdb/cropped/2019-xdb-128c-hanging-toes-to-bar-m2-600x600.jpg,https://www.bodybuilding.com/exercises/muscle/abdominals,Abdominals,https://www.bodybuilding.com/exercises/equipment/body-only,Body Only,9,Average
Narrow-stance squat,"Stand with your feet shoulder-width apart or slightly narrower, toes pointed slightly outward.
Hold a barbell across your upper back and shoulders.
Keeping your chest up and core engaged, squat down by bending your knees and pushing your hips back.
Lower yourself until your thighs are parallel to the ground or as low as you can comfortably go.
Push through your heels to return to the starting position, squeezing your glutes at the top.
Repeat for the desired number of repetitions.",https://www.bodybuilding.com/images/2020/xdb/cropped/xdb-30a-narrow-stance-squat-m1-square-600x600.jpg,https://www.bodybuilding.com/images/2020/xdb/cropped/xdb-30a-narrow-stance-squat-m2-square-600x600.jpg,https://www.bodybuilding.com/exercises/muscle/quadriceps,Quadriceps,https://www.bodybuilding.com/exercises/equipment/barbell,Barbell,9,Average
Kneeling cable oblique crunch,"Kneel down facing a cable machine with a rope attachment at the top pulley.
Grasp the rope with both hands and hold it beside your head.
Crunch your torso down towards your hip, focusing on using your obliques to perform the movement.
Slowly return to the starting position and repeat for the desired number of repetitions on each side.",https://www.bodybuilding.com/images/2020/xdb/cropped/xdb-36c-kneeling-cable-oblique-crunch-m1-square-600x600.jpg,https://www.bodybuilding.com/images/2020/xdb/cropped/xdb-36c-kneeling-cable-oblique-crunch-m2-square-600x600.jpg,https://www.bodybuilding.com/exercises/muscle/abdominals,Abdominals,https://www.bodybuilding.com/exercises/equipment/cable,Cable,9,Average
Reverse Grip Triceps Pushdown,"Attach a straight bar to the high pulley of a cable machine and grasp it with an underhand grip.
Stand upright with your feet shoulder-width apart and your elbows tucked in at your sides.
Push the bar down towards the floor by extending your elbows, focusing on contracting your triceps.
Pause briefly at the bottom of the movement, then slowly return to the starting position.
Repeat for the desired number of repetitions.",https://www.bodybuilding.com/images/2020/xdb/cropped/xdb-19c-reverse-grip-cable-straight-bar-push-down-m1-square-600x600.jpg,https://www.bodybuilding.com/images/2020/xdb/cropped/xdb-19c-reverse-grip-cable-straight-bar-push-down-m2-square-600x600.jpg,https://www.bodybuilding.com/exercises/muscle/triceps,Triceps,https://www.bodybuilding.com/exercises/equipment/cable,Cable,9,Average
Bear crawl sled drag,"a. Attach a sled to a harness around your waist.
b. Get into a bear crawl position with your hands on the ground and knees slightly bent.
c. Start walking forward while dragging the sled behind you using your arms and legs.
d. Maintain a straight back and engage your core throughout the movement.
e. Continue for the desired distance or time.",https://www.bodybuilding.com/images/2020/xdb/cropped/2020-xdb-153s-bear-crawl-sled-drag-m1-crop-600x600.jpg,https://www.bodybuilding.com/images/2020/xdb/cropped/2020-xdb-153s-bear-crawl-sled-drag-m4-crop-600x600.jpg,https://www.bodybuilding.com/exercises/muscle/quadriceps,Quadriceps,https://www.bodybuilding.com/exercises/equipment/other,Other,9,Average
Rocky Pull-Ups/Pulldowns,"a. Set up a pull-up bar at a height where you can fully extend your arms.
b. Grab the bar with a wide grip, palms facing away from you (pull-up) or palms facing towards you (pulldown).
c. Pull yourself up (pull-up) or pull the bar down towards your chest (pulldown) while engaging your back muscles.
d. Lower yourself down with control and repeat for the desired number of reps.
e. Keep your core tight and avoid swinging your body.",https://www.bodybuilding.com/exercises/exerciseImages/sequences/279/Male/m/279_1.jpg,https://www.bodybuilding.com/exercises/exerciseImages/sequences/279/Male/m/279_2.jpg,https://www.bodybuilding.com/exercises/muscle/lats,Lats,https://www.bodybuilding.com/exercises/equipment/other,Other,9,Average
Snatch-Grip Behind-The-Neck Overhead Press,"a. Stand with your feet shoulder-width apart and grip a barbell with a wide snatch grip behind your neck.
b. Press the barbell overhead until your arms are fully extended.
c. Lower the barbell back down to the starting position behind your neck.
d. Keep your core tight and avoid arching your back excessively.
e. Repeat for the desired number of reps.",,,https://www.bodybuilding.com/exercises/muscle/shoulders,Shoulders,https://www.bodybuilding.com/exercises/equipment/barbell,Barbell,9,Average
Box Squat with Bands,"a. Set up a box or bench behind you at knee height.
b. Place resistance bands around the barbell and secure them to the ground or the rack.
c. Sit back onto the box, allowing your hips to drop below parallel.
d. Drive through your heels and stand up explosively, pushing against the resistance bands.
e. Lower yourself back down onto the box and repeat for the desired number of reps.",,,https://www.bodybuilding.com/exercises/muscle/quadriceps,Quadriceps,https://www.bodybuilding.com/exercises/equipment/barbell,Barbell,9,Average
Flexor Incline Dumbbell Curls,"a. Sit on an incline bench with a dumbbell in each hand, palms facing upwards.
b. Let your arms hang straight down at your sides.
c. Curl the dumbbells upwards towards your shoulders while keeping your upper arms stationary.
d. Squeeze your biceps at the top of the movement.
e. Lower the dumbbells back down with control and repeat for the desired number of reps.",,,https://www.bodybuilding.com/exercises/muscle/biceps,Biceps,https://www.bodybuilding.com/exercises/equipment/dumbbell,Dumbbell,9,Average
Seated One-Arm Dumbbell Palms-Up Wrist Curl,"a. Sit on a bench with a dumbbell in one hand, palm facing up, and your forearm resting on your thigh.
b. Allow the dumbbell to roll down towards your fingertips.
c. Curl the dumbbell back up towards your forearm by flexing your wrist.
d. Lower the dumbbell back down with control and repeat for the desired number of reps.
e. Switch to the other arm and repeat.",,,https://www.bodybuilding.com/exercises/muscle/forearms,Forearms,https://www.bodybuilding.com/exercises/equipment/dumbbell,Dumbbell,9,Average
Machine Bicep Curl,"a. Adjust the seat height and weight on the machine according to your preference.
b. Sit down and grab the handles with an underhand grip.
c. Curl the handles towards your shoulders while keeping your upper arms stationary.
d. Squeeze your biceps at the top of the movement.
e. Lower the handles back down with control and repeat for the desired number of reps.",,,https://www.bodybuilding.com/exercises/muscle/biceps,Biceps,https://www.bodybuilding.com/exercises/equipment/machine,Machine,9,Average
Seated Palms-Down Barbell Wrist Curl,"a. Sit on a bench with your forearms resting on your thighs and a barbell in your hands, palms facing down.
b. Allow the barbell to roll down towards your fingertips.
c. Curl the barbell back up towards your forearms by extending your wrists.
d. Lower the barbell back down with control and repeat for the desired number of reps.",,,https://www.bodybuilding.com/exercises/muscle/forearms,Forearms,https://www.bodybuilding.com/exercises/finder,,9,Average
Car driver,"a. Sit on a bench or stability ball with your knees bent and feet flat on the ground.
b. Hold a weight plate or medicine ball close to your chest with both hands.
c. Rotate your torso to one side, bringing the weight across your body.
d. Return to the center and then rotate to the other side.
e. Continue alternating sides for the desired number of reps.",,,https://www.bodybuilding.com/exercises/muscle/shoulders,Shoulders,https://www.bodybuilding.com/exercises/equipment/other,Other,9,Average
Alternating Deltoid Raise,"a. Stand with a dumbbell in each hand, palms facing your body.
b. Lift one dumbbell straight out to the side until it reaches shoulder height.
c. Lower the dumbbell back down with control while simultaneously lifting the other dumbbell.
d. Alternate lifting each dumbbell while maintaining control and avoiding swinging.
e. Repeat for the desired number of reps on each side.",,,https://www.bodybuilding.com/exercises/muscle/shoulders,Shoulders,https://www.bodybuilding.com/exercises/equipment/dumbbell,Dumbbell,9,Average
Hanging Oblique Knee Raise,"a. Hang from a pull-up bar with an overhand grip, hands slightly wider than shoulder-width apart.
b. Engage your core muscles and lift your knees towards your chest while twisting your torso to the side.
c. Lower your legs back down with control and repeat on the other side.
d. Continue alternating sides for the desired number of repetitions.",https://www.bodybuilding.com/images/2020/xdb/cropped/2019-xdb-120c-hanging-oblique-crunch-m1-600x600.jpg,https://www.bodybuilding.com/images/2020/xdb/cropped/2019-xdb-120c-hanging-oblique-crunch-m2-600x600.jpg,https://www.bodybuilding.com/exercises/muscle/abdominals,Abdominals,https://www.bodybuilding.com/exercises/equipment/body-only,Body Only,9,Average
Bodyweight Flyes,"a. Lie on your back on the floor or a bench with your knees bent and feet flat.
b. Extend your arms out to the sides, palms facing up, in line with your shoulders.
c. Keeping a slight bend in your elbows, bring your arms together in a hugging motion, squeezing your chest muscles.
d. Return to the starting position with control and repeat for the desired number of reps.",https://www.bodybuilding.com/images/2020/xdb/cropped/2019-xdb-182s-double-bar-roll-out-chest-fly-m1-600x600.jpg,https://www.bodybuilding.com/images/2020/xdb/cropped/2019-xdb-182s-double-bar-roll-out-chest-fly-m2-600x600.jpg,https://www.bodybuilding.com/exercises/muscle/chest,Chest,https://www.bodybuilding.com/exercises/equipment/ez-curl-bar,E-Z Curl Bar,9,Average
Standing Calf Raises,"a. Stand with your feet hip-width apart near a wall or sturdy object for balance.
b. Lift your heels off the ground as high as possible, contracting your calf muscles.
c. Hold for a moment at the top, then lower your heels back down until you feel a stretch in your calves.
d. Repeat for the desired number of repetitions.",https://www.bodybuilding.com/images/2020/xdb/cropped/xdb-117s-standing-calf-raise-m1-square-600x600.jpg,https://www.bodybuilding.com/images/2020/xdb/cropped/xdb-117s-standing-calf-raise-m2-square-600x600.jpg,https://www.bodybuilding.com/exercises/muscle/calves,Calves,https://www.bodybuilding.com/exercises/equipment/machine,Machine,9,Average
Push-Ups - Close Triceps Position,"a. Start in a plank position with your hands close together directly under your shoulders.
b. Lower your body towards the ground by bending your elbows, keeping them close to your sides.
c. Push back up to the starting position, fully extending your arms.
d. Keep your core engaged throughout the movement and repeat for the desired number of reps.",https://www.bodybuilding.com/images/2020/xdb/cropped/xdb-104a-close-push-up-m1-square-600x600.jpg,https://www.bodybuilding.com/images/2020/xdb/cropped/xdb-104a-close-push-up-m2-square-600x600.jpg,https://www.bodybuilding.com/exercises/muscle/triceps,Triceps,https://www.bodybuilding.com/exercises/equipment/body-only,Body Only,9,Average
One-Arm Long Bar Row,"a. Stand with your feet shoulder-width apart, holding a barbell with an overhand grip in one hand.
b. Bend at the hips, keeping your back straight, until your torso is almost parallel to the ground.
c. Pull the barbell towards your hip, keeping your elbow close to your body and squeezing your back muscles.
d. Lower the barbell back down with control and repeat for the desired number of reps before switching sides.",https://www.bodybuilding.com/images/2020/xdb/cropped/xdb-124s-single-arm-landmine-bent-over-row-m1-square-600x600.jpg,https://www.bodybuilding.com/images/2020/xdb/cropped/xdb-124s-single-arm-landmine-bent-over-row-m3-square-600x600.jpg,https://www.bodybuilding.com/exercises/muscle/middle-back,Middle Back,https://www.bodybuilding.com/exercises/equipment/barbell,Barbell,9,Average
Overhead cable curl,"a. Stand facing a cable machine with a straight bar attachment at the top.
b. Grasp the bar with an underhand grip, hands shoulder-width apart, and arms fully extended overhead.
c. Keeping your upper arms stationary, curl the bar downwards towards your forehead, contracting your biceps.
d. Slowly return to the starting position and repeat for the desired number of repetitions.",,,https://www.bodybuilding.com/exercises/muscle/biceps,Biceps,https://www.bodybuilding.com/exercises/equipment/cable,Cable,9,Average
Single-dumbbell front raise,"a. Stand with your feet shoulder-width apart, holding a dumbbell in one hand with an overhand grip.
b. Extend your arm straight out in front of you, keeping a slight bend in your elbow.
c. Raise the dumbbell up to shoulder height, keeping your arm straight, then slowly lower it back down.
d. Repeat for the desired number of reps before switching sides.",https://www.bodybuilding.com/images/2020/xdb/cropped/xdb-18d-single-dumbbell-front-raise-m1-square-600x600.jpg,https://www.bodybuilding.com/images/2020/xdb/cropped/xdb-18d-single-dumbbell-front-raise-m2-square-600x600.jpg,https://www.bodybuilding.com/exercises/muscle/shoulders,Shoulders,https://www.bodybuilding.com/exercises/equipment/dumbbell,Dumbbell,9,Average
Incline cable chest fly,"a. Set up an incline bench at a low angle in front of a cable machine with D-handle attachments.
b. Lie face-up on the bench with a D-handle in each hand, palms facing inward.
c. Extend your arms out to the sides with a slight bend in your elbows, maintaining tension on the cables.
d. Bring the handles together in a hugging motion, squeezing your chest muscles at the top, then return to the starting position.
e. Repeat for the desired number of repetitions.",https://www.bodybuilding.com/images/2020/xdb/cropped/xdb-10c-incline-cable-chest-fly-m1-square-600x600.jpg,https://www.bodybuilding.com/images/2020/xdb/cropped/xdb-10c-incline-cable-chest-fly-m2-square-600x600.jpg,https://www.bodybuilding.com/exercises/muscle/chest,Chest,https://www.bodybuilding.com/exercises/equipment/cable,Cable,9,Average
Single-leg depth squat,"a. Stand on one leg with your other foot slightly lifted off the ground.
b. Squat down by bending your standing leg while keeping your chest up and back straight.
c. Lower yourself until your thigh is parallel to the ground or as low as you can comfortably go.
d. Push through your heel to return to the starting position.
e. Repeat for the desired number of repetitions before switching legs.",https://www.bodybuilding.com/images/2020/xdb/cropped/xdb-68e-single-leg-depth-squat-m1-square-600x600.jpg,https://www.bodybuilding.com/images/2020/xdb/cropped/xdb-68e-single-leg-depth-squat-m4-square-600x600.jpg,https://www.bodybuilding.com/exercises/muscle/quadriceps,Quadriceps,https://www.bodybuilding.com/exercises/equipment/bands,Bands,9,Average
